{
  "schemaVersion": 1,
  "id": "w01-l01",
  "week": 1,
  "order": 1,
  "title": "因果推断的研究任务",
  "summary": "把描述、预测与干预效果分开，为一个可回答的因果问题确定人群、时间起点、处理和结局。",
  "status": "ready",
  "readingMinutes": 18,
  "tags": [
    "研究问题与研究设计"
  ],
  "objectives": [
    "将同一数据中的问题分成描述、预测与因果三类。",
    "写出有明确时间顺序和比较策略的研究问题。",
    "区分随机抽样、随机分配与分析中的调整。"
  ],
  "prerequisites": [
    "比例和均值"
  ],
  "sections": [
    {
      "id": "three-tasks",
      "title": "同一张预约表的三种用途",
      "blocks": [
        {
          "type": "paragraph",
          "text": "一家门诊准备评估预约提醒服务。数据库有年龄、既往失约次数、是否收到提醒和本次是否按时到诊。先别急着选择回归模型：不同问题需要不同的证据。描述问题关心这个月发生了什么；预测问题关心下一位患者可能发生什么；因果问题关心改变提醒服务会使到诊情况怎样变化。以下情境和所有数字均为原创教学构造。"
        },
        {
          "type": "table",
          "headers": [
            "任务",
            "具体问题",
            "相应评价"
          ],
          "rows": [
            [
              "描述",
              "本月预约者的失约比例是多少",
              "分母、缺失、抽样代表性与区间"
            ],
            [
              "预测",
              "用预约时已有的信息，预测谁会失约",
              "在未用于训练的数据中检查区分度和校准"
            ],
            [
              "因果",
              "给符合条件的预约者统一发送提醒，比不发送能减少多少失约",
              "先论证两种策略的可比性，再估计同一人群的结果对比"
            ]
          ],
          "caption": ""
        },
        {
          "type": "paragraph",
          "text": "一个预测模型可能把提醒服务列为失约的强预测因子，因为工作人员优先提醒此前频繁失约的人。这样的预测可以很准确，却不能直接说明提醒使人失约。预测评估回答的是模型在既定资料生成过程中的表现，干预效果还涉及改变处理分配后的结果。"
        }
      ]
    },
    {
      "id": "protocol",
      "title": "先写一份简短研究方案",
      "blocks": [
        {
          "type": "paragraph",
          "text": "本课的目标可写成：在预约登记当天符合条件的成年人中，比较预约前一天发送一条统一格式短信与不发送短信，对预约后30天窗口内该次约诊失约风险的影响（Y=1表示失约）。时间零点设在资格判断和策略分配一致的时点；若以实际发送为准，则要相应重写时间零点及策略，避免先随访、再按未来信息分组。"
        },
        {
          "type": "list",
          "items": [
            "人群：哪些预约者能够进入研究；重复预约怎样处理。",
            "处理：发送时点、内容、频率和对照策略具体是什么。",
            "结局：预先定义完成约诊及失约；取消、改期和未联系到如何编码。",
            "随访：从共同起点开始，设定相同窗口，并说明失访。",
            "目标尺度：失约风险差，单位是百分点；也可另外报告风险比。"
          ],
          "ordered": true
        },
        {
          "type": "paragraph",
          "text": "把患者从研究开始后能否联系到来分组，会用到处理后的信息。只比较成功收到短信的人和未收到者，也偏离最初的分配策略。方案写得越具体，后续判断变量时序、选择样本和解释结果就越容易。"
        }
      ]
    },
    {
      "id": "design",
      "title": "研究设计决定比较的依据",
      "blocks": [
        {
          "type": "table",
          "headers": [
            "设计",
            "提供的信息",
            "需要留意"
          ],
          "rows": [
            [
              "随机分配试验",
              "用已知随机机制分配提醒策略",
              "分配在概率意义上独立于潜在结果；单次样本仍可能不均衡"
            ],
            [
              "观察性队列",
              "记录实际接受服务及以后发生的结局",
              "工作人员的选择可能与结局风险有关，需要测量并处理混杂"
            ],
            [
              "病例对照抽样",
              "按结局状态抽取病例与对照",
              "抽样比例通常改变表中事件比例，不能把它当总体风险"
            ],
            [
              "横断面调查",
              "同一时期测量暴露和状态",
              "先后顺序和入样过程可能难以确定"
            ]
          ],
          "caption": ""
        },
        {
          "type": "paragraph",
          "text": "随机抽样涉及研究样本怎样来自目标人群，主要关系到代表性及外推。随机分配涉及入组后怎样接受处理，主要为组间因果比较提供依据。一个便利样本也可以随机分配；一个有代表性的样本也可能存在处理混杂。这两件事需要分别说明。"
        }
      ]
    },
    {
      "id": "worked",
      "title": "从人数算到效果尺度",
      "blocks": [
        {
          "type": "paragraph",
          "text": "设一个教学试验把200人分到短信组，200人分到对照组。观察到短信组30人失约，对照组50人失约，且此例假定完整随访。短信组风险为30/200=0.15，对照组为0.25。两组之差为−0.10，即短信分配组的失约风险低10个百分点。该数字还存在抽样不确定性；它本身没有给出对其他门诊人群的推广依据。"
        },
        {
          "type": "equation",
          "text": "RD = p₁ − p₀ = 0.15 − 0.25 = −0.10；RR = p₁ / p₀ = 0.60",
          "caption": "RD是绝对差；RR是相对比。相对风险降低为40%，与10个百分点含义不同。"
        },
        {
          "type": "code",
          "language": "R",
          "execution": "not-run",
          "code": "events <- c(reminder = 30, usual = 50)\nn <- c(reminder = 200, usual = 200)\nrisk <- events / n\nc(RD = unname(risk[1] - risk[2]), RR = unname(risk[1] / risk[2]))\nstopifnot(all(events <= n), abs(unname(risk[1]-risk[2]) + 0.10) < 1e-12)",
          "caption": "原创 base R 练习；当前环境未执行。"
        },
        {
          "type": "callout",
          "title": "随机化以后仍需要检查",
          "text": "依从性、失访、结局测量和分组后排除都可能影响要回答的问题。基线表中的P值较大不构成随机化成功或无偏的证明。",
          "tone": "warning"
        }
      ]
    },
    {
      "id": "practice",
      "title": "自测与小任务",
      "blocks": [
        {
          "type": "exercise",
          "id": "w01-l01-goal",
          "prompt": "某模型在新样本中能准确预测失约，但提醒服务系数为正。最稳妥的结论是：",
          "options": [
            "短信会增加失约",
            "模型可用于相应预测任务；干预解释还需要研究设计与识别论证",
            "加入更多变量就一定能把系数解释为因果效应"
          ],
          "answer": 1,
          "explanation": "预测准确与干预效果是不同目标。高风险者优先被提醒可以产生正的观测关联；更复杂的模型也不能自动修复未测混杂。"
        },
        {
          "type": "exercise",
          "id": "w01-l01-scale",
          "prompt": "短信组风险15%，对照组25%。风险差的正确表达是：",
          "options": [
            "降低10个百分点",
            "降低10%且与风险比同义",
            "每个人的失约概率都降低40%"
          ],
          "answer": 0,
          "explanation": "15%−25%=−10个百分点；风险比为0.6。平均风险的差没有承诺每个人都有相同效果。"
        },
        {
          "type": "paragraph",
          "text": "动手练习：把自己关心的一个研究题目改写成六行方案，包括人群、时间零点、处理、对照、结局窗口和效果尺度。最后另写一句：现有数据中，处理为什么会落在某些人身上。这个问题会直接引出下一课的混杂。"
        }
      ]
    }
  ],
  "references": [
    {
      "id": "hernan-robins-2020",
      "title": "Causal Inference: What If",
      "authors": "Miguel A. Hernán; James M. Robins",
      "year": 2020,
      "url": "https://miguelhernan.org/whatifbook",
      "locator": "第1章：因果效应的定义；第2章：随机试验；第3章：观察性研究"
    }
  ],
  "exerciseIds": [
    "w01-l01-goal",
    "w01-l01-scale"
  ],
  "codeStatus": "not-run"
}
