{
  "schemaVersion": 1,
  "id": "w01-l02",
  "week": 1,
  "order": 2,
  "title": "混杂偏倚及其控制",
  "summary": "用分层数据看清粗比较如何混合人群构成与处理差异，并为混杂控制建立正确边界。",
  "status": "ready",
  "readingMinutes": 20,
  "tags": [
    "混杂与调整"
  ],
  "objectives": [
    "用共同原因和变量时序解释混杂。",
    "手算粗风险、层内风险和标准化风险。",
    "识别P值筛选、调整中介和简单相加系数的局限。"
  ],
  "prerequisites": [
    "w01-l01；风险与加权平均"
  ],
  "sections": [
    {
      "id": "structure",
      "title": "混杂来自处理选择和结局风险的共同来源",
      "blocks": [
        {
          "type": "paragraph",
          "text": "仍以预约提醒为例。工作人员更可能为既往多次失约的人发送提醒；既往失约者本次也更容易失约。于是，提醒组与对照组在接受服务之前就具有不同的风险构成。直接比较两组，会同时带入服务的作用与原有人群差异。"
        },
        {
          "type": "diagram",
          "kind": "confounding-dag",
          "caption": "原创基本结构：W影响处理A，也影响结局Y。图中箭头表达待论证的因果假设。"
        },
        {
          "type": "paragraph",
          "text": "混杂、随机误差与其他系统误差要分开。随机误差来自有限样本波动，可借区间表达；混杂涉及比较对象不可交换；选择偏倚可能来自入组或留在分析样本的机制；测量偏倚涉及错误记录处理、结局或协变量。扩大样本量能减少一些随机波动，却不会自动消除共同原因带来的偏倚。"
        }
      ]
    },
    {
      "id": "reversal",
      "title": "两层人群中的方向反转",
      "blocks": [
        {
          "type": "paragraph",
          "text": "构造400人的教学数据。W=0表示既往低失约风险，W=1表示高风险。提醒组的高风险者占80%，对照组仅占20%。表内人数和事件完全为教学设定。"
        },
        {
          "type": "table",
          "headers": [
            "处理",
            "风险层",
            "人数",
            "失约人数",
            "层内风险"
          ],
          "rows": [
            [
              "提醒",
              "低",
              "40",
              "2",
              "5%"
            ],
            [
              "提醒",
              "高",
              "160",
              "40",
              "25%"
            ],
            [
              "对照",
              "低",
              "160",
              "16",
              "10%"
            ],
            [
              "对照",
              "高",
              "40",
              "16",
              "40%"
            ]
          ],
          "caption": ""
        },
        {
          "type": "equation",
          "text": "粗风险差 = (2+40)/200 − (16+16)/200 = 21% − 16% = +5个百分点",
          "caption": ""
        },
        {
          "type": "paragraph",
          "text": "提醒组总体看起来更差，但每个风险层内提醒组的风险都更低：低风险层差−5个百分点，高风险层差−15个百分点。发生反转的原因可以在算式里看到：粗比较对提醒风险使用80%的高风险权重，对对照风险使用20%的高风险权重。比较时人群构成也变了。"
        },
        {
          "type": "equation",
          "text": "共同目标各占一半：μ₁ = 0.5×0.05+0.5×0.25 = 0.15；μ₀ = 0.5×0.10+0.5×0.40 = 0.25",
          "caption": ""
        },
        {
          "type": "paragraph",
          "text": "把两种处理放在低、高风险各一半的目标人群中，标准化风险差为−10个百分点。这个计算把已记录的W构成统一了。若W之外仍有影响服务分配和失约的共同原因，例如未记录的联系方式稳定性，因果解释仍可能有偏。"
        }
      ]
    },
    {
      "id": "adjustment",
      "title": "不同阶段的控制方法",
      "blocks": [
        {
          "type": "list",
          "items": [
            "设计阶段：随机分配可建立处理分配的可交换性；限制入组范围能固定某些特征，同时缩小目标人群；匹配需保留其设计信息进入分析。",
            "分析阶段：分层在协变量较少时直观；回归以模型汇总条件均值；标准化统一平均权重；倾向得分围绕处理分配构建设计。",
            "未测混杂：敏感性分析刻画结论对未测因素的依赖；阴性对照可提供偏倚线索；工具变量依赖另一组特定识别条件。这些方法的作用不能混为一谈。"
          ],
          "ordered": false
        },
        {
          "type": "paragraph",
          "text": "一个变量是否应调整取决于目标问题和时序。收到短信后是否点击链接可能是提醒影响到诊的中间步骤；估计提醒的总效应时把它固定，会阻断部分作用。仅因它与A、Y都相关就纳入模型，依据不充分。DAG一课会进一步解释共同结果变量为何也会引入问题。"
        },
        {
          "type": "callout",
          "title": "基线差异的P值不能判定混杂",
          "text": "P值受样本量和抽样波动影响。P>0.05不能排除重要共同原因，P<0.05也不能证明某变量是该因果问题的混杂因素。应结合测量时间、领域知识及因果结构。",
          "tone": "warning"
        }
      ]
    },
    {
      "id": "linear",
      "title": "在线性模型中分清效应与遗漏项",
      "blocks": [
        {
          "type": "paragraph",
          "text": "在一个简化线性例子中，A是是否参加预约辅导，W是基线困难评分，Y是后续困难评分。若总体均值关系为Y=α+βA+γW+误差，且误差与A不相关，忽略W后得到的粗斜率还包含两组W的差异。"
        },
        {
          "type": "equation",
          "text": "b粗 = β + γ × Cov(A,W) / Var(A)",
          "caption": "这是线性投影关系，要求Var(A)>0；不能照搬到OR或HR。"
        },
        {
          "type": "paragraph",
          "text": "当A为0/1时，Cov(A,W)/Var(A)等于两组W均值之差。设真正的条件平均差β=−3，W每升1分使Y升4分，参加者W平均比未参加者高2分，则粗差为−3+4×2=5分。遗漏偏倚包含γ与组间W差的乘积；直接写成β+γ会丢掉关键一项。"
        },
        {
          "type": "code",
          "language": "R",
          "execution": "not-run",
          "code": "n1 <- c(40, 160); y1 <- c(2, 40)\nn0 <- c(160, 40); y0 <- c(16, 16)\nq1 <- y1 / n1; q0 <- y0 / n0\ntarget <- c(0.5, 0.5)\ncrude <- sum(y1)/sum(n1) - sum(y0)/sum(n0)\nadjusted <- sum(target * (q1 - q0))\nc(crude_RD = crude, standardized_RD = adjusted)\nstopifnot(abs(crude - 0.05) < 1e-12, abs(adjusted + 0.10) < 1e-12)",
          "caption": "原创 base R 练习；当前环境未执行。"
        }
      ]
    },
    {
      "id": "practice",
      "title": "自测与解释",
      "blocks": [
        {
          "type": "exercise",
          "id": "w01-l02-target",
          "prompt": "若目标人群全部为高风险层，本例标准化风险差是多少？",
          "options": [
            "+5个百分点",
            "−10个百分点",
            "−15个百分点"
          ],
          "answer": 2,
          "explanation": "目标人群100%高风险时，只比较该层的25%和40%。目标权重改变，平均效应随层内效应差异而改变。"
        },
        {
          "type": "exercise",
          "id": "w01-l02-pvalue",
          "prompt": "基线困难评分在小样本中的组间比较P=0.18，但领域知识认为它影响参加辅导和结局。应如何处理？",
          "options": [
            "直接删去，因为不显著",
            "保留为需论证的基线调整变量，并检查模型与数据支持",
            "先把它改成显著的分类方式"
          ],
          "answer": 1,
          "explanation": "统计非显著不能排除其因果角色。分组阈值也不应为了获得显著性而反复修改。"
        }
      ]
    }
  ],
  "references": [
    {
      "id": "hernan-robins-2020",
      "title": "Causal Inference: What If",
      "authors": "Miguel A. Hernán; James M. Robins",
      "year": 2020,
      "url": "https://miguelhernan.org/whatifbook",
      "locator": "第7章：混杂；第2–3章：标准化与观察性研究的识别条件"
    },
    {
      "id": "vanderweele-2019",
      "title": "Principles of confounder selection",
      "authors": "Tyler J. VanderWeele",
      "year": 2019,
      "url": "https://link.springer.com/article/10.1007/s10654-019-00494-6",
      "locator": "Statistical confounder selection"
    }
  ],
  "exerciseIds": [
    "w01-l02-target",
    "w01-l02-pvalue"
  ],
  "codeStatus": "not-run"
}
